{"$schema":"https://json-schema.org/draft/2020-12/schema","$id":"https://kaveep.dev/dev-agent/schemas/engineering-proposal.schema.json","title":"KAVEEP DEV-AGENT Engineering Proposal","type":"object","required":["proposalId","schemaVersion","requestRef","planRef","contextRef","objective","analysis","assumptions","proposedEdits","validationFiles","risks","requiresPolicyEvaluation","requiresKcp","requiresHumanApproval","proposalAuthorizesExecution","status","recommendedNextAction"],"properties":{"proposalId":{"type":"string","pattern":"^engineering_proposal_[A-Za-z0-9][A-Za-z0-9_-]*$"},"schemaVersion":{"type":"string","const":"1.0.0"},"requestRef":{"type":"string","pattern":"^request_[A-Za-z0-9][A-Za-z0-9_-]*$"},"planRef":{"type":"string","pattern":"^plan_[A-Za-z0-9][A-Za-z0-9_-]*$"},"contextRef":{"type":"string","pattern":"^context_[A-Za-z0-9][A-Za-z0-9_-]*$"},"objective":{"type":"string","minLength":1},"analysis":{"type":"string","minLength":1},"assumptions":{"type":"array","items":{"type":"string","minLength":1}},"proposedEdits":{"type":"array","items":{"type":"object","required":["operation","path","reason"],"properties":{"operation":{"type":"string","enum":["create","overwrite","append","replace"]},"path":{"type":"string","minLength":1},"reason":{"type":"string","minLength":1},"text":{"type":"string"},"search":{"type":"string"},"replaceAll":{"type":"boolean"}},"additionalProperties":false}},"validationFiles":{"type":"array","items":{"type":"string","minLength":1},"uniqueItems":true},"risks":{"type":"array","items":{"type":"object","required":["level","description","mitigation"],"properties":{"level":{"type":"string","enum":["low","medium","high","critical"]},"description":{"type":"string","minLength":1},"mitigation":{"type":"string","minLength":1}},"additionalProperties":false}},"requiresPolicyEvaluation":{"type":"boolean"},"requiresKcp":{"type":"boolean"},"requiresHumanApproval":{"type":"boolean"},"proposalAuthorizesExecution":{"type":"boolean","const":false},"status":{"type":"string","const":"proposed"},"recommendedNextAction":{"type":"string","enum":["review_proposal","gather_more_context","request_policy_evaluation","request_kcp","request_human_approval"]}},"additionalProperties":false}
