{"proposalId":"engineering_proposal_example_001","schemaVersion":"1.0.0","requestRef":"request_example_001","planRef":"plan_example_001","contextRef":"context_example_001","objective":"Add a validated greeting export.","analysis":"The observed module can be updated with one bounded overwrite.","assumptions":["The public export is intentionally changed."],"proposedEdits":[{"operation":"overwrite","path":"src/index.mjs","reason":"Add the requested export.","text":"export const greeting = 'hello';\n"}],"validationFiles":["src/index.mjs"],"risks":[{"level":"low","description":"Public export changes.","mitigation":"Run syntax validation and review the diff."}],"requiresPolicyEvaluation":false,"requiresKcp":false,"requiresHumanApproval":true,"proposalAuthorizesExecution":false,"status":"proposed","recommendedNextAction":"review_proposal"}
